titulo_banco;slug_servico
Declaração para fins de proporcionalização ou isenção do desconto do INSS acima do teto;declaracao-para-fins-de-proporcionalizacao-ou-isencao-do-desconto-do-inss-acima-do-teto109
Emitir DAEMS – pagar emolumentos e taxas à PGE;emitir-daems-pagar-emolumentos-e-taxas-a-pge132
ICMS Diferencial de Alíquotas - dispensa da cobrança na aquisição de maquinário por industrial ou produtor rural;icms-diferencial-de-aliquotas-dispensa-da-cobranca-na-aquisicao-de-maquinario-por-industrial-ou-produtor-rural84
Parcelar débitos de taxa de fiscalização e de multas da AGEMS;pedir-parcelamento-de-debitos-de-taxa-de-fiscalizacao-e-de-multas-de-competencia-da-agems144
Verificar recolhimento do ITCD em processos de inventário e similares;verificacao-do-recolhimento-do-itcd70
